code,year,type,subtype,fatalities,location,source,description
,1935.00,assassination,political,1,LA,Kirkham et al. 1970,"Sen. Huey P. Long shot, killed by Dr. Carl Weiss. Apparent concern over Long's power, and having his father-in-law's judgeship taken away"
,1935.03,riot,race,4,"Harlem, NY",HC_1935_04_01.pdf,A black shot by police
,1935.04,riot,political,2,"Gallup, NM",HC_1935_04_05.pdf,"A sheriff and a jobless miner were shot dead , 7 wounded"
,1935.07,riot,prison,1,Salem OR,HC_1936_08_01.pdf,"1 inmate killed, 2 wounded"
,1935.11,lynching,political,1,"Tampa, FL",Gilje,"November: Police seize six ""Modern Democrats"" (socialists). After their release, three were seized by a gang of whites, were stripped, flogged, and tarred and feathered. They were promised death if they did not leave town. One died 9 days later from wounds."
,1936.00,riot,"labor, race",1,AR,Gilje,Whites harrass and beat black sharecroppers on strike. One woman died from her wounds.
,1936.00,lynching,race,1,"Oxford, MS",Gilje,"Mob took Ellwood Higgiboth, a black, from jail during a murder trial and executed him."
,1936.04,riot,race,3,"Gordonsville, VA",Gilje,"April: William Wales, elderly black man who refused to sell land to the city, shot and killed the sheriff as he came to arrest him on trumped up charges that he threatened a white woman. A crowd of 5,000 surrounded his house. Wales and his sister fought off the crowd till night when a torch was thrown and the two defenders were shot in the light provided. After the building burned the remains were hacked to pieces."
,1936.08,riot,prison,1,"Milledgeville, GA",HC_1936_08_26.pdf,"One Is Slain, 15 Shot"
,1937.04,lynching,race,2,"Duck Hill, MS",Gilje,"April: Whites seized two blacks in broad daylight in downtown Winona, brought them to Duck Hill and killed them with a blow torch."
D,1937.05,riot,labor,10,Chicago,HC_1937_07_01.pdf,Memorial Day riot at the plant of the Republic Steel Company
,1937.05,riot,labor,10,Chicago,Gilje,"May: Memorial Day massacre. Hundreds of strikers picket and confront a police line outside a Republican Steel plant. Some rocks and stones thrown. Police use revolvers and fire into pickets only a few yards away. Police then charge fleeing pickets, swinging clubs, beating many. Ten strikers killed. 30 suffer gunshot wounds and 28 others hospitalized. 16 police injured."
D,1937.06,riot,labor,2,"Youngstown, OH",NYT_1937_06_21.pdf,Republic Steel strike. 2 picketeers dead
,1937.06,riot,labor,2,"Youngstown, OH",Gilje,"June: Rioting broke out all night as conflict erupted between strikers and deputies outside Republic Steel plant. Two persons killed, 42 men and women injured, all but 8 were strikers. Governor then sent National Guard to the area."
,1937.07,riot,labor,2,"Massillion, OH",Gilje,"July: Police fire into picket lines of striking steelworkers - who were dancing in the street - when a striker did not turn the lights off his automobile. Two strikers killed, several injured."
,1938.10,lynching,race,1,"Rustin, LA",Gilje,"October: W.C. Williams, a black man, was lynched by a white mob of 1,500. A black man, possibly someone other than Williams, had allegedly killed a white man and assaulted a white woman."
,1938.12,lynching,race,1,"Stone Co, MS",Gilje,"December: Mob lynched young black man for assaulting an elderly white woman, but he was really only guilty of not knowing his place."
X,1939.00,assassination,revenge,1,New York,Kirkham et al. 1970,"Louis E. Edwards, Mayor of Long Beach, NY, shot and killed by Alvin Dooley. Angered that Edwards used influence to keep him from being elected to office in police organization"
,1941.08,riot,race,2,"Fayetteville, NC",Gilje,"August: Black soldiers on Jim Crow bus to take them back to Camp - Fort Bragg - fight with white MPs. Some shots fired. One black killed, one white, two other MPs wounded, three blacks."
,1941.08,riot,prison,1,"Ft. Knox, KY",HC_1941_08_04.pdf,1 soldier killed during a guardhouse riot
,1941.08,riot,economic,3,NYC,HC_1941_08_20.pdf,"3 women were trampled as 10,000 tried to force their way on a boat desgined for 3,000"
,1942.01,riot,prison,3,"Bridgewater, MA",HC_1942_01_02.pdf,"2 Prisoners Run Amuck, Slay 3 guards"
,1942.01,lynching,race,1,"Sikeston, MO",Gilje,"January: White mob of 30 seize Cleo Wright from jail, stuff him in a trunk of a car, take him to the black section, drag him behind the auto and set his body ablaze. Wright, a cotton mill worker, had been accused of attacking a white woman and had been wounded resisting arrest. Case becamse a cause celebre."
,1942.04,riot,race,1,Ft. Dix,HC_1942_04_04.pdf,Riot between white and colored troops. Fatalities. 
,1942.07,lynching,race,1,"Texarkana, TX",Gilje,July: Black arrested for attempting to rape a white woman. He was shot during arrest and place in the hospital. A mob of 50 whites took him out of the hospital shortly after midnight and tied him to a rope and dragged him around from a car. They then hanged the body near a factory loading platform.
,1942.10,lynching,race,1,"Jones Co, MS",Gilje,"October: When a jury decided on only life imprisonment for a black convicted of murdering his white employer, a group of 50 whites took the man out of jail about midnight and took him to an isolated bridge and hanged the man about 1:00am."
,1942.10,lynching,race,1,"Laurel, MS",Gilje,October: White mob lynched a black after court sentenced him to life in prison for murdering a white.
,1942.10,lynching,race,2,"Quitman, MS",Gilje,"October: Whites hanged two black 14 year olds, allegedly for attempted rape [this occurred five days before Laurel event]"
,1942.12,riot,ethnic,1,"Manzanar, CA",HC_1942_12_08.pdf,"1 Japanese killed, 9 wounded"
,1943.01,riot,race,1,"Impo, CA",HC_1943_01_20.pdf,Black soldiers vs police. 
,1943.05,riot,race,1,"El Paso, TX",Gilje,"May-June: White and black soldiers fight. One black killed, one white critically wounded."
,1943.06,riot,race,4,"Beaumont, TX",HC_1943_06_18.pdf,"3 blacks and 1 white killed, 50 injuires (EARR). Whites attacking blacks."
D,1943.06,riot,race,34,Detroit,HC_1943_07_21.pdf,Detroit race riots. 25 blacks and 9 whites killed
,1943.06,riot,race,34,Detroit,Gilje,June: Race riot took 34 lives and $2 million in property damage. Began on Sunday with interracial fight at Belle Isle amusement park. Blacks attacked white property in black neighborhood.
D,1943.08,riot,race,6,NYC,EARR II: 477,"6 blacks killed, 40 police injured"
,1943.08,riot,race,5,NYC,Gilje,"August: Five dead, 500 wounded in race riot. Began upon report of a white policeman shooting a black soldier interfering with the arrest of a black woman. Property damage estimated at $5,000,000. Hundreds of stores wrecked and looted. 500 arrested."
,1944.01,riot,race,1,"Ripley, TN",Gilje,"January: About 30 black soldiers from Dyersburg Air Force base became involved in a shooting. One soldier dies, and two civilian police wounded."
,1944.11,riot,race,1,Seattle,HC_1944_11_26.pdf,Ft. Lawton. Black vs Italian soldiers. 1 Italian hanged
,1945.05,riot,prison,2,"Ft. Benjamin, IL",HC_1945_06_02.pdf,"1 guard killed, a fireman died of heart attack"
,1945.10,lynching,race,1,"Madison, FL",Gilje,October: White mob lynched Jessem S. Payne. Payne had defied his white employer. Trumped up charges that Payne had raped a five year old white girl landed him in jail. At night a mob seized him and drove him to an isolated location and riddled his body with bullets.
,1946.02,riot,race,2,"Columbia, TN",Gilje,"February: Race riot. Militia seize 300 weapons in house to house search after 10 persons are injured and 70 arrested. On February 28, two blacks killed in the Maury county jail."
,1946.02,riot,prison,1,"Milwaukee, WI",HC_1946_02_10.pdf,A food riot in the United States disciplinary barracks
,1946.03,riot,prison,2,"County Jail, Tennessee",Leeke 1973,03/01 2 inmates killed
,1946.05,riot,prison,5,"Alcatraz, CA",NYT,"May 2-4, 1946 - Alcatraz. Two guards and three inmates were killed in a riot that units of the marines helped quell after landing on the island in San Francisco Bay."
D,1946.07,lynching,race,4,"Monroe, GA",NYT,A band of men shot and killed four Negroes 
,1946.07,lynching,race,4,"Monroe, GA",Gilje,"July: After Roger Malcolm's wife and two friends posted bail for Malcolm - he had been arrested for fighting with a white - a fifth black person drove them home. The car was intercepted on a side road - the driver may have been paid off or something. A mob stopped them. They seized the two men and when Malcolm's wife died(?) one of the mob, they took the two women too. The 20-30 white men executed the four."
,1946.08,lynching,race,1,"Minden, LA",Gilje,"August: Ex-GI John C Jones arrested on false accusation of raping a white woman. The sheriff had coerced a confession out of his cousin. Jones had complained about his father's oil leases. That night, the police released the two, who were immediately taken by 10 white men, driven out of town, and beaten - Jones died; his cousin lived.	Burran."
,1946.08,lynching,race,1,"Wilson, NC",Gilje,"August: A band of 20 whites hunted down and killed an ex-GI, JC Farmer. Farmer had shot the local constable with the constable's own gun during a fight."
,1947.02,lynching,race,1,"Pickens, SC",Gilje,"February: A mob of 50 whites took black Willie Earle from jail - they were asked not to use profanity and shown Earle's cell by the jailer. Later, Earle's body was found hanging from a bridge five miles away, with knife wounds and half his head blown away by a shotgun. This case became a cause celebre, nationally."
,1947.04,rampage,,4,"Bronx, NY",NYT,"Richard King, 45 years old, of 793 Jennings Street, the Bronx, shot and killed two women in that borough yesterday afternoon, went to Manhattan and killed a man and then shot himself fatally."
,1947.05,riot,prison,1,"Ft. Leavenworth, KS",HC_1947_05_05.pdf,"1 inmate killed, 6 injured, 5 guards injured"
,1947.08,riot,prison,8,"Glynn Co. Camp, GA",Leeke 1973,08/12 8 inmates killed
,1949.09,rampage,,13,"Camden, NJ",NYT,"Howard B. Unruh killed 13 people on September 6, 1949, in Camden, New Jersey, when he was 28 years old. Unruh is considered the first single-episode mass murderer in U.S. history"
X,1949.09,rampage,insane,1,"Suffern, NY",NYT,"A mentally disturbed war veteran, who wrecked a lunchroom and injured four persons after being refused an after-hours bottle of beer was shot dead early today by a police lieutenant whose skull he had fractured with a metal chair."
X,1949.12,rampage,family,5,"Butte, MT",NYT,"A 21-year-old miner's daughter tonight wiped out five members of her family, including herself"
,1951.08,rampage,education,2,"Kansas City, KS",NYT,"A young man shot a University of Kansas City language professor to death today and fifty-five minutes later killed a Negro woman neighbor. He told the police that he was ""mad at them."""
,1951.12,terrorism,race,2,Florida,Wiki,"Harry Tyson Moore (November 18, 1905–December 25, 1951) was an African-American teacher who founded the first branch of the National Association for the Advancement of Colored People (NAACP) in Brevard County, Florida.Moore and his wife Harriette died as a result of injuries after their home was bombed. The first NAACP activist to be murdered, Moore has been called the first civil rights martyr."
,1952.03,rampage,,3,"Merriman, NE",NYT,"A 32-year-old ranch hand who killed three persons and wounded two, including an infant, in a midnight shooting spree was shot to death today by a posse that fired 1,000 shots and burned down three buildings to get him."
,1952.04,riot,prison,1,So. Michigan Prison,Leeke 1973,04/21 1 inmate
,1952.08,riot,prison,1,"Bordeux Jail, ??",Leeke 1973,08/02 1 inmate
X,1953.04,rampage,family,9,"Lawrence, MA",NYT,"Peter Akulonis killed 9 members of his family, and then took his life as the police closed in on him"
,1953.06,riot,prison,2,New Mexico Penitentiary,Leeke 1973,06/15 2 inmates
,1953.08,riot,prison,1,Washington State Reformatory,Leeke 1973,08/21 1 inmate
X,1953.09,rampage,criminal,5,"Canandigua, NY",NYT,Fred McManus with girlfriend kills 5 people
,1954.06,riot,prison,1,"Pontiac State Penitentiary, IL",Leeke 1973,06/24 1 inmate
,1954.09,riot,prison,4,"Missoury State Penitentiary, MO",Leeke 1973,09/23 4 inmates
X,1954.10,riot,prison,1,"Jefferson City, MO",HC_1954_10_24.pdf,One prisoner was killed and 29 others injured.
,1954.10,riot,prison,1,"Missoury State Penitentiary, MO",Leeke 1973,10/23 1 inmate
X,1955.01,rampage,revenge,1,"Swarthmore, PA",NYT,A Swarthmore College psychology student killed a sleeping schoolmate with a rifle early today in retaliation for a series of pranks.
X,1955.05,rampage,criminal,4,"Dayton, OH",NYT,"A gunman, firing wildly, shot and killed three persons and wounded five others today in two banks. He was shot by the police."
,1955.08,riot,prison,1,"Bexar County Jail, TX",Leeke 1973,08/03 1 inmate
,1955.08,lynching,race,1,"Money, MS",EARR II:639,Emmett Till was lynched for whistling at a white woman.
X,1957.05,rampage,family,2,NYC,NYT,"Andrew Casey, the 14-year-old high school freshman who shot and killed his mother and sister last night, "
,1957.08,riot,prison,1,Colorado State Reformatory,Leeke 1973,08/28 1 inmate
,1958.01,rampage,,11,Nebraska,NYT,"Charles Starkweather with girlfriend went on three day spree in which he stabbed and shot to death 9 people in Nebraska, another one in Wyoming, and an 11th he confessed killing. Starkweather was later executed."
,1958.10,rampage,,1,"Boulder City, NV",NYT,A newly hired Las Vegas policeman who went on an unexplained shooting rampage during which he had also killed a 60-year-old man
,1959.04,lynching,race,1,"Pearl River, MS",EARR II:495,"Mack Charles Parker, a black, lynched by a white crowd for allegedly raping a white woman."
,1959.04,lynching,race,1,"Poplarville, MS",Gilje,"April: Lynching of young black awaiting trial for rape of white woman. His body was found near Bogaluse, LA, with two bullet wounds. Whites feared a mis-trial of the black, because no blacks could serve on juries."
,1959.04,riot,prison,6,Montana State Prison,Leeke 1973,"04/17 2 inmate, deputy warden, 3 guards killed"
,1959.08,rampage,,2,"Philadelphia, PA",NYT,CRAZED MAN KILLS 2 IN OLD-AGE HOME; Wounds Five in Philadelphia Rampage -- Once Sought Help at White House
,1960.03,riot,race,1,"Jacksonville, FL",Gilje,March: Three days of rioting acompanying sit-ins including KKK attacks on demonstrators and the shooting death of one black bystander.
,1960.08,riot,race,1,"Jacksonville, FL",HC_1960_08_31.pdf,Blacks vs Whites
X,1960.12,rampage,family,3,"Stamford, CT",NYT,"The man who killed his two teen-age daughters and committed suicide here yesterday had a record of a previous killing, the police disclosed today."
,1961.10,rampage,work,5,"Gary, IN",NYT,"A workman, suspended for talking back to his supervisor, killed four men and wounded three others in a steel mill here today."
,1962.00,riot,race,1,"Jackson, MS",EARR I: 412,"A riot following Univ. of Miss. registration of James Meredith, the first black to study at UM. 2 dead, 375 wounded"
,1962.04,riot,race,1,Los Angeles,HC_1962_04_29.pdf,"Black Muslims vs police. 1 black killed, 6 wounded. 1 policeman wounded"
X,1962.08,rampage,insane,1,NYC,NYT,A woman social worker was killed yesterday and two others were critically injured by a former mental patient who went on a stabbing rampage through a Queens clinic.
,1962.10,riot,race,2,"Oxford, MS",Gilje,"October: The forced admission of James H. Meredith to the University of Mississippi triggered several days of rioting by white students and others. Two men were killed, one a newsman, and more than 60 injured, including 25 marshalls. Ultimately 13,500 Federal troops were used. The number of rioters was about 2,500 at its height. Some shots were fired."
,1963.00,assassination,political,1,TX,Kirkham et al. 1970,"Pres. John Kenedy shot, killed by Harvey Lee Oswald"
,1963.06,assassination,race,1,"Jackson, MS",EARR I:209,"KKK: Medgar Evers' assassination, on June 12, 1963, in Jackson, Mississippi, was another episode in the Klan's violent campaign against racial integration and civil rights for African-Americans."
,1963.06,riot,race,4,"Lexington, NC",Gilje,June: 500 white men marched on black section night of 5th in reaction to desegregation campaign. They were met by 100 blacks. Rocks and bottles thrown. Shots fired. One white man killed.
,1963.08,riot,race,1,"Jacksonville, FL",HC_1964_08.12.pdf,A Negro woman was killed at the height of a race riot last spring.
,1963.09,terrorism,race,4,"Birmingham, AL",EARR,"""Bombingham"": 4 girls are killed when KKK bombs 16th St. Baptist Church. Sept. 15"
,1964.05,rampage,,44,CA,Wiki,"Francisco Paula Gonzales, 27, shot both the pilot and co-pilot on Pacific Air Lines Flight 773 before turning the gun on himself, causing the plane to crash and killing all 44 aboard."
D,1964.06,lynching,race,3,"Meridian, MS",Wiki,The Mississippi Civil Rights Workers Murders involved the 1964 slayings of three political activists during the American Civil Rights Movement.
,1964.06,lynching,race,3,"Meridian, MS",Gilje,"June: Three Civil Rights workers, two white, one black, were apparently taken by Klansmen after being released from jail and murdered. 21 were later arrested, including the county sheriff."
,1964.07,riot,race,4,"Albany, NY",HC_1964_07.27.pdf,"1 white killed, 3 die when a police helicopter crashes. 350 injured"
,1964.07,lynching,race,1,"Colbert, GA",Wiki,"Lt. Col. Lemuel A. Penn (September 19, 1915 in Washington, D.C. - July 11, 1964 in Madison County, Georgia) was an African American United States Army Reserve officer who was killed by members of the Ku Klux Klan in 1964, nine days after the Civil Rights Act was passed."
D,1964.07,riot,race,1,"Harlem, NYC",HC_1964_07.17.pdf,Riots after a police lieutenant shot and killed a Negro youth.
,1964.07,riot,race,1,"Harlem, NYC",Gilje,"July: Four days of rioting. One black shot to death, five other shot and wounded, 81 civilians and 35 police injured; 112 stores and businesses damaged; 185 arrested. A killing of a 15 year old black by an off-duty police officer supposedly triggered the riot."
,1964.07,riot,race,4,"Rochester, NY",EARR II:567,"4 deaths, 350 injuries"
D,1964.07,riot,race,1,"Rochester, NY",Gilje,"July: After an arrest of a black youth rioting erupted. Looting and attacks on police. Molotov cocktails, stones, etc., were thrown. Report of some gunfire. Also report of some fighting between whites and blacks. One white man was killed, 35 persons injured, 22 of whom were police. At least 400 persons arrested."
,1964.11,riot,prison,3,"Menard State Penitentiary, IL",Leeke 1973,11/24 3 guards killed
,1964.12,assassination,race,1,"Ferriday, LA",Gilje,December: Shoe shop burned by several white men. They prevented the escape of a black man. He later died at a hospital.
,1965.02,riot,political,1,"Marion, AL",NYT_1965_03_04.pdf,Bloody Sunday (EARR): Jimmie Lee Jackson was fatally injured when Alabama state troppers broke up a civil rights night march Feb. 18 at Marion.
,1965.03,riot,,1,Selma,Gilje,March: Three white Unitarian ministers who had joined freedom marchers during voter registration drive were beaten by a group of whites on the street corner. One later died.
,1965.03,lynching,race,1,"Selma, AL",Wiki,"KKK: Viola Gregg Liuzzo (April 11, 1925 – March 25, 1965) was a civil rights activist from the U.S. state of Michigan and mother of five, who was murdered by Ku Klux Klan members after the 1965 Selma to Montgomery marches in Alabama. "
X,1965.07,rampage,family,3,"Pittsburgh, PA",NYT,"Leroy Scott 25-year-old man spurned by his teen-aged girlfriend, armed with a 22-rigle forced his way into girfriend house. Police were called. Police shot Leroy's girlfriend's father. Leroh killed a policeman. Later he was shot by the police (or committed suicide)"
D,1965.08,riot,race,36,Los Angeles,HC_1965_08.15.pdf,Watts riot
,1965.08,riot,race,34,Los Angeles,Gilje,"August: Watts riot. 34 killed, devastating black area. Estimated 7,000 to 10,000 blacks participated. Firearms and molotov cocktails used. Much looting and arson and rock throwing. A total of 3,952 people arrested. 1,032 people injured. 28 of the dead were black. 200 buildings destroyed. $40 million worth of property destroyed. National Guard called out (total of 12,364)"
,1965.11,riot,prison,3,"Menard, IL",HC_1965_11.24.pdf,"3 guards srtabbed to death, 5 wounded"
,1966.00,riot,race,2,Chicago,Gilje,"July: Blacks on the West Side rioted for three days. Riot began when police attempted to close fire hydrants. Temperature high 98 degrees. Two blacks killed, scores of police and civilians injured and 372 arrested. Six police wounded by bullets from snipers. Looting extensive. Molotov cocktails, bricks, rocks, etc., thrown. Six fire stations evacuated. ML King and others helped negotiate a settlement. National Guard called in."
,1966.00,riot,race,4,"Cleveland, OH",NYT_1966_07_19.pdf,Rioting broke out last night in the all-Negro Hough area of Cleveland. A woman was shot and killed and four policemen were injured by bricks and bottles.
,1966.00,riot,race,1,"Dayton, OH",EARR I:148,"1 death, 30 injuries"
,1966.01,rampage,work,4,"Upton, NY",NYT,
D,1966.03,riot,race,2,Los Angeles,HC_1966_03.16.pdf,600 Negroes Riot In Watts District
,1966.03,riot,race,2,Los Angeles,Gilje,"March: Watts - rioting in 12 square block area. Two dead, 20 injured, 49 persons arrested, 19 buildings damaged. Started at Jordan High school. Some tension between blacks and Mexican-Americans."
,1966.07,riot,race,10,Chicago,HC_1966_07.17.pdf,"2 blacks shot to death, 8 black girls massacred. 6 policemen wounded "
,1966.08,rampage,education,16,"Austin, TX",NYT,"Charles J. Whitman turned the University of Texas campus into a slaughtering ground for 16 persons, including himself."
,1966.08,riot,race,1,"Benton Harbor, MI",Gilje,"August: On four consecutive nights black youths, crowd size 50-400, threw stones and bottles at store windows, cars, and policemen. 13 blacks and three whites arrested. On August 31 one black died. He had been shot by two white men in a car the night before."
,1966.11,rampage,,5,"Mesa, AZ",NYT,"Robert B. Smith, high school senior, killed 5 people."
,1967.00,riot,race,1,Cincinnati,EARR I:107,"Blacks set fires, stoned businesses, fought with police. 1 person killed"
D,1967.05,riot,race,1,"Houston, TX",NYT_1967_06_03.pdf,"Texas Southern University riot. A policeman was killed in a riot May 16 and 17 on the campus of Texas Southern University, the predominantly Negro school."
D,1967.05,riot,race,1,"Houston, TX",HC_1967_06_03.pdf,"Texas Southern University riot. Police officer Louis R. Kuba killed, 2 others wounded"
,1967.05,riot,race,1,"Houston, TX",Gilje,"May: At predominately black Texas Southern University. During rally on the 16th a student hurled a watermelon at a police car. Four policemen arrest the student. As they drove off, bottles and rocks were thrown. When the car stopped, shots were fired from Lanier Hall. Two policemen were wounded. The police sealed off the campus. Students threw bottles of gasoline and erected a barricade. Police opened fire on Lanier Hall for forty minutes and then 100 officers rushed the place. One was killed. The police trashed the building. In Lanier Hall police found one one shotgun, a rifle, and a pistol."
D,1967.05,riot,race,1,"Jackson, MS",HC_1967_05_13,"Rioting at the Jackson State College: 1 man dead, 3 wounded. National Guard called."
,1967.05,riot,race,1,"Jackson, MS",Gilje,"May: Two nights of rioting at Jackson State. First night, 1500 participated after two black policemen stopped a speeder on campus. Second night, about 100 rioters built a bonfire on a main street in campus. They rushed the police twice. The police fired into the crowd, killing one, wounding two others. 1,200 to 1,400 Guardsmen called in to calm the situation."
,1967.06,riot,race,1,"Atlanta, GA",EARR,"1 man killed, 1 boy wounded by police shooting into a crowd"
,1967.06,rampage,,3,Iowa,NYT,"Hubert B. McClelland killed a woman, abducted her two daughters, then killed a man and his son"
D,1967.07,riot,race,43,Detroit,HC_1967_07_29.pdf,"39 people killed, thousands injuries and arrests. Federal paratroopers called."
,1967.07,riot,race,43,Detroit,Gilje,"July: 43 killed. 7202 arrested. Over 2000 injured. 5000 left homeless. 1442 separate fires started. Damage between $250 and $500 million. Guardsmen and US Army sent in. Looting, firebombs, sniping etc. Guadsmen used machineguns from tanks. Began with police raid on after-hours drinking establishment and alleged police brutality. A total of 13000 to 14000 police, National Guadsmen, and Army used to quell riot."
,1967.07,riot,race,23,"Newark, NJ",EARR II:447,"The Newark riots of 1967, July 12-17. 23 dead, 700 injured."
D,1967.07,riot,race,19,"Newark, NJ",HC_1967_07_15.pdf,18 blacks and  a white policeman killed
D,1967.07,riot,race,26,"Newark, NJ",Gilje,"July: 26 persons killed, 1500 injured, 1397 arrested. Over 300 fires. Property damage $15 to $30 million. Arrest of a black taxi driver triggered the disturbance. Rumored he was killed. Rocks, bottles, etc., thrown at police station. Rioting spread. Looting, fires, etc. There was sniping. As many as 3,000 Guardsmen sent in. Governor was refused Federal help.	"
,1967.07,riot,political,2,"Rogersville, TN",NYT,"A murderous affray took place yesterday at Rogersville between the Radicals and Conservatives. Gov. BROWNLOW'S advices are that when MAYNARD and ETHERIDGE reached the place two opposing processions were formed, and that while marching through town the Etheridge men fired upon the Radicals, killing one man and wounding two."
,1967.07,riot,race,1,"Wadesboro, NC",HC_1967_07_23.pdf,James W. Moore was shot in the arm and run down by the automobile.
