code,year,type,subtype,fatalities,location,source,description
,1782.05,lynching,political,1,South Carolina,Gilje,May: After Judge Aedewus (??) Burke's Court failed to convict a tory and accused horse thief a crowd of men led by General William Butler seized the tory and hanged him.
,1784.03,lynching,political,1,"Montgomery, Ulster Co. NYC",Gilje,"March: A Tory was shot when he attempted to settle in Whig territory. A Whig mob came to him. He ran and was shot.	"
,1784.07,riot,economic,2,"Ft. Dickinson, Wyoming Valley, PA",Gilje,"Pennamite-Yankee War. July: John Franklin and Yankees besiege Pennamites under Alexander Patterson. In various battles, two Yankees killed and Franklin wounded. Cease fire arranged on 31st.	"
,1784.07,riot,economic,2,"Wyoming Valley, PA",Gilje,"Pennamite-Yankee War.  July: Yankees and Pennamites skirmish. Two Yankees killed (""lost"") in the ambush by William Patterson's men (Pennamite with a quasi-legal commission)	"
,1784.09,riot,economic,2,"Ft. Dickinson, Wyoming Valley, PA",Gilje,"Pennamite-Yankee War.  September: In August a supposedly neutral militia force convinced both Pennamites and Yankees to lay down arms, but then arrested the Yankees. By September, most of the Yankees were free and determined to use violence. Yankees again attack Ft. Dickinson. After two hour battle, two Yankees wounded, two Pennamites killed, two Pennamites wounded.	"
,1784.10,riot,economic,1,"Ft. Dickinson, Wyoming Valley, PA",Gilje,"Pennamite-Yankee War. October: John Armstrong led a partisan militia force in an attack on the Connecticut men who defended themselves in a cluster of log houses. Two attackers slightly wounded; one defender mortally wounded. Attackers had to retreat.	"
,1784.12,lynching,political,1,"96 District, SC",Gilje,"December: A returning Tory was arrested and tried before a judge. Acquitted, the ex-Tory was lynched, with all due respect to the laws, after the judge moved on in his circuit. The judge himself was not particularly disturbed by the affair.	"
,1787.01,riot,political,2,"Berkshire Co, MA",Gilje,"Shays' Rebellion. January:  a government party led by lawyer Theodore Sedgewick confronted about 100 local Shaysites on their way to Springfield, fought with them. The result was two Shaysites killed."
,1787.01,riot,political,2,"South Hadley, MA",Gilje,"Shays' Rebellion. January: Shaysites captured four retailers. Two Shaysites lost their lives in the process.	"
,1787.01,riot,political,4,"Springfield, MA",Gilje,"Shays' Rebellion. January: About 1500 Shaysites approach arsenal and battle begins. Artillery made the difference; Shaysites lost four dead and 20 wounded.	"
,1787.02,riot,political,10,"Stockbridge, MA",Wiki,"Shays' Rebellion. February: About 120 farmers from Mass left New Lebanon, NY on the 20th for Western Mass. On the 27th they reached Stockbridge, and harassed local storekeepers. They ransacked 17 houses and took 20 prisoners. They then went to Barrington and captured 19 men there. Outside of Sheffield, however, a party of government troops caught up with them. In the ensuing battle the Shaysites lost 30 men killed or wounded, government three dead, dozens wounded.	"
X,1787.05,executions,political,2,"Stockbridge, MA",Szatmary 1980:115,"Death sentences for 13 rebels. Two hanged: John Bly, Charles Rose."
,1788.04,riot,,3,NYC,HC_1788_05_05.pdf,New York Ant-Dissection Riot.
,1791.10,riot,economic,1,"Noblestown, NY",Gilje,"October: Young says a jacquire (??) occurred. Philip Schuyler attempted to have evicted some yankee squatters. Jonathon Arnold was threatened with an execution by the county sheriff. On the day of the sale ""the Noblestown people assembled and with threats detered the deputy from proceeding with the vendue (??)."" A few days later the county sheriff, Cornelius Hogeboom, and the county judge, Stephen Hogeboom, appeared with a deputy. After waiting all afternoon for another deputy to arrive with the necessary papers and after ""a number of people assembled in a riotous manner"" they began to leave. At that point Arnold fired a pistol; 17 men in Indian dress appeared firing and marching after them. Sheriff Hogeboom thought it was only meant to frighten them. One of the Indians, along with Arnold, rode up to him and shot him dead. The Indians fled and the deputies retreated to Federalist Hudson and organized a posse. Thirteen men including Arnold were eventually arrested and placed in a heavily guarded jail. But with anti-Fed judges no one was convicted. Young says the conflict was Fed vs Anti-Fed.	fn. Albany Gazette, October 31, 1791; Franklin Ellis. The History of Columbia Co., NY, (1878) p.62,236; Albany Register, October 24, 1791"
,1794.07,riot,political,1,"Bower Hill, PA",Gilje,"Whiskey Rebellion. July 16: 50 men armed with rifles and clubs surround home of John Neville, federal excise tax supervisor. Neville shot one man who later died. 5 wounded."
,1794.07,riot,political,3,"Bower Hill, PA",Slaughter 1986:180,"Whiskey Rebellion. July 17: A crowd of 400-800 locals battle with Neville, supported by Major Kirkpatrick and 10 soldiers. Killed: McFarlane and 1-2 other rebels, and 1 soldier later died of his wounds."
,1794.09,riot,political,1,"Myerstown, PA",Slaughter 1986: 205,Whiskey Rebellion. Sept 29: Dragoons rounded up suspected rebels; one young man killed by mistake.
,1794.10,riot,political,1,"Myerstown, PA",Slaughter 1986: 206,"Whiskey Rebellion. Oct 1: An altercation between soldiers an civilians. Charles Boyd, a drunken civilian killed."
,1794.10,riot,political,1,"Myerstown, PA",Slaughter 1986: 218,Whiskey Rebellion. Late Oct: At least one of the suspected rebels captured by the troops died of exposure.
,1797.00,lynching,race,1,Georgia,Gilje,"A mob condemned a slave to the flames - burning the victim.	"
,1797.10,riot,political,1,Upper Marlborough,Gilje,"October: Election riot with brick bats and stones. One man was killed. Over sheriff election.	"
,1799.03,riot,ethnic,1,NYC,Gilje,"March: Effigy paddies cause disturbance on day of celebration for St. Patrick in Harmon Street. One man was killed.	"
,1802.00,riot,?,1,"Charleston, SC",Gilje,"Charles Richardson was killed in a riot in Chalmer's Alley. Patrick Leonard, Thomas Nicholson, and Joseph Frowks (a Portuguese) were charged with the crime and committed to prison.	"
,1803.04,riot,prison,2,"Kingston, NY	",HC_1803_04_13.pdf,"New York State Prison riot. Soldiers, quelling the riot, killed a non-participating inmate. A rioter later died of his wounds."
,1804.09,riot,"ethnic, race",3,"Elktown, MD",Gilje,"September: A number of united Irishmen, canal workers, left off work, went to the race track armed with bludgeons and (??). There they paraded about and became involved in a fight with some blacks. They demolished one free black's stall and chased the rest of the blacks toward town. The blacks bought protection from the whites. Several gentlemen of the races attempted to intercede. The Irish attacked these gentlemen too and a battle ensued between this mounted gentry armed with whips and Irish ruffians. Some of the gentry were injured, but it is implied that the rioters got the worst of it, a few of whom, it was said, died afterwards. On their approach to the races the Irish are reported as declaring they could whip double their number of Americans.	"
,1806.08,riot,political,1,Boston,Gilje,"Thomas O. Selfridge (lawyer Federalist), in the course of a feud with Benjamin Austin (Republican), became involved in insults and an altercation with Austin on August 4, 1806, which ended by Selfridge's killing Austin. Selfridge defended his action successfully and was acquitted on the ground of self-defense. Yet the people of Boston were greatly aroused and was hard pressed ""to elude the fury of democracy,"" for ""thre fiends of anarchy, night after night, have prompted the perpetration of the most wanton outrages against the liberty, security, and the legitimate rights of man!""	"
,1806.12,riot,?,2,NYC,Gilje,"December: A riot occurred Christmas night in Augustus street. Two watchmen were killed and two companies of militia were ordered out to restore order.	"
D,1812.07,riot,political,2,Baltimore,HC_1812_08_04.pdf,"Baltimore Riot: 1 dead, another ""desparied of"", a third seriously injured."
,1812.07,riot,political,2,Baltimore,Gilje 1996: 62-3,"Baltimore Riot started with the destruction of the Federal-Republican (newspaper) building. During the fughting between a Republican mob the Federalists shot and killed a shopkeeper. The Republicans rolled up a cannon, but did not use it. The Federalists surrendered and were led to the jail. That night a mob attacked the jail and beat several Federalists to a pulp. Gen. James M. lingan was beaten to death."
,1813.00,riot,economic,1,"Columbia Co, NY",Gilje 1996:76,"Mobs opposed collection of rents. In one confrontation, a sheriff was killed"
,1819.10,riot,race,1,"Pittsfield, MA",HC_1819_10_19.pdf,"An altercation between US Army soldiers and some Negroes, which started in a brothel, led to a death of one Negro"
,1825.00,riot,economic,1,"Ulster, Delaware and Sullivan Co, NY",Gilje,"Anti-rent. Some land rioting in Ulster, Delaware and Sullivan counties partially between rival landowning families and partially between landlord and tennants. During these problems Capt. Geradus Hardenberg shot and killed. He was a landowner. 	"
,1825.08,riot,political,1,"Halifax, NC",Gilje,"August: An affray occurred at the Courthouse during an election, Hamlin Turner, a young man from the country, was shot and died of his wounds. Henry Potter, of Halifax, was injured but recovered.	"
,1825.11,riot,extralegal,1,"Portland, ME",HC_1825_11_22.pdf,Portland Brothel Riots
,1827.06,lynching,race,1,"Perry Co, AL",Gilje,"June: A mob of 70 or 80 persons burnt a black alive because he had stabbed a white man. The black had been accused of stealing a small piece of property and was stabbed when hassling the black about it. The black was taken to a Justice, who waived jurisdiction in the case and then led the mob himself as its President. This was the 2nd time in the county that a black had been so burnt.	"
,1828.00,riot,labor,1,Susquehannah River Canal,Gilje,"Irish laborers riot near Wilkes-Barre. No cause given, evidently attack on contractors, one man killed by rioters.	"
,1828.08,riot,"ethnic, labor",1,Northern Liberties,Gilje,"August: Irish weavers riot, leaving one watchman dead. The rioters seized a building and hoisted a flag of the weaver's trade.	"
,1828.08,riot,ethnic,1,Philadelphia,Gilje,"August: Kensing weavers riot. Stephen Heimer, a watchman, was killed. Heimer was off duty. He entered an Irish tavern, made noise as he had in the street, 3rd street above Poplar Lowe, and called the owners ""bloody Irish transports."" Hence he was attacked. He had been asked to be quiet because there was a dying woman in the house.	"
,1829.05,riot,labor,1,"Nanticoke, PA",Gilje,"May: Near the town ""foreigners"" employed on the North Branch canal rioted. One man was killed, several were beaten. Some of the ringleaders escaped, others were captured.	"
,1829.08,riot,labor,1,Baltimore,Gilje,"August: Several disturbances by laborers at B+O railroad. On Friday Aug. 14 one man was killed near city, several wounded. On Sunday rioters ransacked the dwelling of Thomas Elliott, one of the contractors.	"
,1829.08,riot,race,1,Cincinnatti,Gilje,"August: In an attempt to enforce an ordinance driving all blacks out of town, a mob attacked the dwelling houses of blacks, breaking windows and on Thursday and Friday night. On Saturday night a group of blacks armed themselves. When the whites attacked, a gun was fired, killing Ely Herricks, a young man. Ten blacks and seven whites were arrested that night and the mayor, on Sunday morning, issued a proclamation calling all good citizens to assist the constituted authorities in preserving the public peace.	"
,1829.09,riot,race,1,"Marrieta, PA",Gilje,"September: Riots at the Banbridge Races between canal workers and the visitors to the races. A black was killed, another man had his leg so battered by a musket shot that it had to be amputated. Others were wounded. A court case is to follow. Those workmen involved are to be dismissed from further employment on the line.	"
X,1830.00,war,indian,1,Georgia,DNI 1830.02.25,Whites vs. Cherokees
,1830.09,riot,ethnic,1,"Dunnstown, PA",Gilje,"September: Canal workers riot in dispute with local Germans over apple picking. One killed.	"
,1831.00,riot,extralegal,4,"Pope Co., IL",Gilje,"A mob of ""honest"" citizens attacked a fort erected by a gang of horse thieves, counterfeiters, and robbers, using small arms and artillery. Three criminals were killed, as was one vigilante.	"
D,1831.09,riot,race,5,"Providence, RI",HC_1831_10_04.pdf,Olney street riot
,1831.09,riot,race,5,"Providence, RI",Gilje,"September: Olney street riot - Began as a fight in a dance hall in which one black beat 5 whites. Spilled out into street as black and white sailors fought one another with the blacks driving the whites out of the neighborhood on the 21st. Next night whites returned, destroying two houses. A black fired on the whites, killing one. The rioting continued. On the 23rd, 25 militiamen were routed by rioters. On the 24th, two militia companies fired on rioters, killing 4.	"
,1833.08,riot,labor,1,"Pennsylvania	",Gilje,"August: German canal worker, Charles Hickenbottom, murdered by about 20 other canal workers. One worker had been dismissed, 20 of his fellow workers quit in sympathy. They then went down to the canal about one mile and attacked Hickenbottom. 11 arrested and charged with murder. Five charged with A+B and riot.	"
,1833.12,riot,ethnic,1,Charleston,Gilje,"December: A group of drunken Irish beat a native American to death. Next night 500 activists marched on Irish. Troops called, but stood helplessly as several houses were destroyed.	"
,1833.12,riot,religion,6,"Jackson Co, MO",DNI 1833.12.07,"2 citizens and 4 Mormons killed, a number wounded"
,1834.00,riot,political,1,"Moyamonsing, PA",HC_1834_10_20.pdf,"Whigs against Jacksonians. ""it appears that several individuals were seriously injured and perhaps one or more killed"""
,1834.01,riot,,10,"Williamsport, MD",HC_1834_02_03.pdf,"The riot among the laborers on the Chesapeake and Ohio Canal. Fighting among the Corkonians, Fardouns, and Longfords."
,1834.03,riot,labor,5,New Orleans,Gilje,"March: Faction fight among canal workers. Several killed. (??) guards ordered out.	"
X,1834.04,riot,political,?,NYC,HC_1834_04_14.pdf,
,1834.06,riot,ethnic,4,Maryland,Gilje,"June: Laborers on Washington railroad rioted. Fight was between Irish factions and four persons were killed. 30 or 40 rioters arrested. Militia from Baltimore ordered out to quell riot. Factions: Fardowns and Corkeans - one of those killed was a woman.	"
X,1834.07,riot,"race, extralegal",0,NYC,HC_1834_07_14.pdf,The Anti-Slavery Society. Attack on Arthur Tappan's store. Farron of the Bowery Theater. Destruction of black-owned houses.
,1834.08,riot,race,2,Philadelphia,Gilje 1996:89,"August: White mob begins by attacking ""flying horses"" amusement establishment that had been used by blacks and whites. But then turned to assaults on blacks and their property for three nights. Two churches and over 30 houses destroyed, damaged, or looted. One black died from the wounds inflicted during beating. 100s flee. Authorities use militia, etc., to quell the riot along Philadelphia."
,1834.10,riot,political,1,Philadelphia,Gilje,"October: Election riots. Jackson men in Moganensing driven from polls. Then whigs took Jackson headquarters, destroying two tents and cutting Jackson hickory tree. Later reinforced, Jackson men attack whig HQ on NE corner of Christian and Mostcalm sts. Whigs fired upon them wounding 15 or 20 - one later died. Enraged, Jackson men stormed the building and drove the whigs out. They set fire to the whig pole - iron bends prevented efforts to drop it down, and the fire spread to nearby houses. When firemen arrived, Jackson men beat them and prevented them from downing the flames.	"
D,1834.11,riot,labor,2,Maryland,HC_1834_12_08.pdf,on the Rail Road between Baltimore and Washington two sub-agents were recently murdered by laborers
,1834.11,riot,"ethnic, labor",3,Maryland,Gilje,"November: Baltimore and Ohio railroad workers - mainly Catholic Irish - riot. Troops called in from Washington DC. Grimsted says this riot included battle between Protestants and Catholics.  Scharf says attack focused on contractor. Indeed, contractor's house attacked and he was beaten. Next day superintendent John Watson and two others killed. 300 Irish laborers arrested.	"
,1835.00,lynching,extralegal,1,"Lynchburg, VA",Gilje,"Summer: An Englishman charged with being an abolitionist hanged.	"
D,1835.06,riot,ethnic,1,NYC,HC_1835_06_29.pdf,Nativist riots in NYC between Irish and Native Americans. A Dr. McCafferty later died of injuries
,1835.06,riot,ethnic,1,NYC,Gilje,"June: Five Point riot between ""Americans"" and foreigners. Police quell. Dr. W.M. Caffrey killed and Justice Lowdnes wounded. Foreigners the Irish - if this is the same riot reported by Billington. Rioters gutted a tavern. Shots fired.	"
,1835.07,lynching,race,1,"Hinds Co., MS",Gilje,"July: Slave insurrection scare infects county and several committees form. When two leading committeemen allowed suspects to go free because of lack of evidence, one, William L. Sharken, came under mob attack. On night of July 6 an armed band from Madison Co. attempted to capture Sharkey. They tried again, but Sharkey defended himself, killing one.	"
,1835.07,lynching,race,3,"Livingston, MS",Gilje,"July: Mob summarily hanged the slaves who had been suspected of organizing a conspiracy. Also seized two white ""steam doctors"" and organized a committee to deal with insurrection. They elicited a confession from one of the whites.	"
,1835.07,lynching,race,2,"Livingston, MS",Gilje,"July: Two whites seized, sentenced by committee to be hanged. Both were executed."
,1835.07,lynching,race,1,"Livingston, MS",Gilje,"July: Fear of slave insurrection swept the state. The Livingston vigilance committee seized a poor man who had brought a load of corn to sell in Yazoo. Despite the efforts of Henry Foote, the comm. Hanged the man on the testimony of 3 secured blacks.	"
,1835.07,riot,extralegal,6,"Vicksburg, MS",Gilje,"July: Argument between gambler and citizen triggered action against gamblers. When the gambler returned armed, apparently to kill the citizen, the crowd seized the gambler, tied him to a tree, whipped him, tarred and feathered him, and banished him. Next day citizens ordered all gamblers out of town. A search of gambling houses on the 6th led to more rioting. Besides destroying tables etc., some gamblers defended one house - rest had been abandoned. During the gun battle one citizen was shot and killed. The five gamblers were seized and hanged by the crowd.	"
D,1835.08,riot,political,5,Baltimore,HC_1835_07_17.pdf, Bank riot. 4 killed and 20 wounded. Riot following failure of the Bank of Maryland.
,1835.08,riot,political,5,Baltimore,Gilje,"August: Bank riot. On the evening of the 6th only a few windows broken as crowd was angry at rich investors because of the apparent failure of the bank of Maryland. Similar actions occurred on the night of the 7th. More serious rioting broke out on Saturday the 8th and mayor's guard, after fighting with clubs, fired into the crowd, killing five and wounding many more. But the rioting continued and the Mayor's guard left town. Six houses sacked between Saturday and Sunday. Voluntary guard under Samuel Smith finally gains control on Monday.	"
,1835.08,riot,political,1,"Post, AR",DNI 1835.09.02,"Pierre Jardeleau, a spectator, killed by a chance shot. One other shot through the legs and cut in several places. Guns and knifes used by combatants."
,1835.10,riot,extralegal,1,"Vergennes, UT",Gilje,"October: Bawdy-house riot. 20-30 men break into house run by local madame. She had been charged with keeping a house of prostitution and wanred to leave several times. As the mob was breaking down the door, someone shot a gun from inside. One man was killed. No other resistance. House quickly leveled. Madame and male employee arrested.	"
,1836.04,riot,race,3,Cincinatti,Gilje,"April: Fist fight between black and white boys triggered riot. White mbos invaded black neighborhood, set fire to houses, beat blacks and forced some to flee. Governor declared martial law, but not before several blacks killed.	"
,1836.04,lynching,race,1,St. Louis,Gilje,"April: Francis L. McIntosh, a black steamboat hand from Pittsburgh, killed a deputy sheriff and wounded another peace officer in resisting arrest. Overpowered McIntosh was placed in jail. But a mob took him from jail and burned him alive. A judge excused those arrested saying that they had been caught up in the ""electric frenzy"" of abolitionism.	"
,1836.08,lynching,race,1,"Helena, Ark",Gilje,"August: Mob hangs a black for stabbing a white during a fight.	"
,1837.10,lynching,race,1,"Vicksburg, Miss",Gilje,"October: Lynch law - ""One man has been dragged from the bosom of his family and so maimed and mutilated as to become an object of horror and pity; another was forced from his house and hung upon the next tree; and on Sunday the 24th an old man named Grace, formerly of Warrington, Va, was tried and acquitted before a magistrate, charged wtih giving free passes to negroes. The lawful decision did not satisfy the mob. He was stripped and flogged within hearing of the shrieks of his wife and children.""	"
,1837.11,riot,extralegal,1,"Alton, IL",HC_1837_11_28.pdf,Elisha Lovejoy killed while defending his press for a 4th time.
,1838.00,riot,ethnic,2,Baltimore,Gilje,"Battle between Union Fire Company and New Market Fire Company led to two deaths.	"
,1838.03,riot,labor,10,"Michigan Canal, IL",Gilje,"March: Dispute over firing workers leads to riot. Militia ordered in. Ten killed.	"
,1838.06,riot,race,2,Philadelphia,Gilje,June: Insane black man killed a watchman. After the funeral a crowd gathered and threatened black neighborhood. Mayor successfully discouraged them. But that evening black homes were attacked. During fighting another white man stabbed to death.
,1838.10,riot,religion,4,"Crooked River, MO",Gilje,"Battle of the Crooked River. October: Mormons attack party of Missourians who had captured three Mormons. Mormons charged and routed opponents. But lost three dead - including leader David Patten and several wounded. Missourians lost 1 dead.	"
,1838.10,riot,religion,18,"Haun's Mill, MO",Gilje,"Haun's Mill Massacre. October: Approximately 240 men from several counties, including several big shots, attacked a Mormon community, killing 18 or 19 people - largely men and boys. Missourians in state militia. Baily says out of 38 men and boys, 17 killed and wounded. Several of the dead were killed after caputre and were wounded already."
,1839.00,riot,extralegal,4,"Bellevue, Iowa",Gilje,"Gun battle between sheriff and his posse against a gang of crooks. Good guys win, but lost four men. They therefore try captives (13 total, 7 had escaped, and others killed): white beans for lounging,"" red beans for whipping - red beans won. This was an extra legal effort. 1839-40	"
,1839.08,riot,ethnic,1,"Little Orleans, MD",Gilje,"August: Irish workers fight with Germans. This involves canal workers. One dead. Militia ordered in, arrests and imprisonments.	"
X,1840.00,riot,extralegal,4,"Pope County, IL",Gilje,1840s. Regulators attack stronghold of counterfeiter by the name of Sturdevant. Some sort of battle erupted. As many as three counterfeiters and one regulator killed. 
,1840.04,riot,extralegal,3,"Bellevue, Iowa",Gilje,"April: Sheriff leads posse in attack on Brown's hotel and gang of thieves. Gun battle unsues. Unclear what authority used. Several killed. Afterward posse takes law into own hands and horsewhips captured bandits.	"
,1840.10,riot,ethnic,1,"St. Louis, MD",Gilje,"October: Ethnic rioting led to the death of at least one person.	"
,1840.11,riot,education,1,"Charlettsville, VA",Gilje,"November: University of Va riot. Students shoots and kills J. Davis, an eminent Va legal scholar.	"
,1841.06,lynching,extralegal,2,"Ogle Co., Illinois",Gilje,"June: Regulators take three captured horse thieves and suspected murderers - Wm. Driscoll and two sons, out of jail. The Driscolls were accused of shooting the Regulator captain John Campbell. They held a trial, sentencing two to death. At the prisoners' request, they shot the man instead of hanging.	"
,1841.07,riot,labor,1,"Carrollton, LA",Gilje,July: Mostly German ropewalk workers beat manager to death and severely injured two others while they investigated charges that the workers had treated brtually a crippled worker.
D,1841.08,riot,race,7,"Cincinnati, OH",HC_1841_09_10.pdf,"A fight between few negores and whites, a crowd of 2-3K attacking negro houses, using a cannon. Both black and white deaths."
,1841.08,riot,race,7,"Cincinnati, OH",Gilje 1996: 90,"August: Several days of fighting between whites and blacks. Blacks wound several whites. On the 3rd night as many as 1800 whites invade black neighborhood. Blacks fire on them and the whites used a cannon to get blacks. At 2:00am militia establish cease fire. Officials convince blacks to surrender arms, and promise that their homes and families would be protected, 200-300 blacks surrender to authorities, mob ignores officials and attacks black houses, church."
,1841.10,lynching,extralegal,2,"Shelbyville, TX",Gilje,"October: 300 Regulators under Watt Moorman held ""trial"" for three members of McFaddin family for murder of Charles Jackson (McFaddin house had been burnt by Jackson earlier). Two oldest McFaddin hanged. Other murders committed by Regulators at this time."
,1842.04,riot,political,3,NYC,HC_1842_04_14.pdf,3 or 4 were wounded so badly none are expected to survive
